Id,Job,Education,Age,Experience,Skills,Softkills,Offered_Salary,City,Nationality,SmartWork,Experience_abroad,Language
0,Lawyer,Degree,41 - 43,22,"Civil Law, Criminal Law, Negotiation","Critical thinking, Persuasive communication, Argumentation",34986,Badesi,Brasiliano,False,True,"Brasiliano, Italiano, Italiano"
1,Financial analyst,Master D.,29 - 40,5,"Risk Management, Economics, Economic Law","Management of stress, Critical analysis, Effective communication, Attention to detail, Problem solving",33504,Monserrato,Italiano,True,False,"Italiano, Venezuelano, Turco"
2,HR Consultant,Master D.,32 - 32,9,"Organisational development, Analysis of data","Negotiation, Management of the conflict, Ability to listen",35009,Fiave',Italiano,True,True,"Italiano, Egiziano"
3,System administrator,Master D.,27 - 30,17,"Unix, HTTP","Troubleshooting, Management of emergencies",37502,Lacco Ameno,Italiano,False,True,"Italiano, Danese, Norvegese"
4,Designer,Degree,24 - 35,3,"Adobe After Effect, CorelDRAW, Adobe Illustrator, Prototyping, Blender","Empathy, Innovation, Adaptability, Critical thinking, Creativity",36005,Montesano Salentino,Italiano,True,False,"Italiano, Statunitense, Francese"
5,Nurse,Researcher,43 - 50,4,"Pharmacology, Health care, Administration of drugs, Medical emergencies, Patient Management","Professional ethics, Organisation, Management of stress",30018,Cornaredo,Italiano,False,True,Italiano
6,Pharmacist,Bachelor D.,39 - 44,13,"Pharmacology, Preparation of drugs, Dispensing of drugs, Information on drugs","Organizational skills, Knowledge of regulations, Communication",23485,San Nicola Arcella,Lituano,False,True,"Lituano, Inglese"
7,Doctor,Degree,28 - 31,14,"Management of patients, Interpretation of the results, Pathology","Attention to the patient, Teamwork, Empathic communication",52515,Fie' allo Sciliar,Italiano,False,True,Italiano
8,Teacher,PhD,36 - 47,6,"Art, Sciences, Office suite","Communication, Empathy, Patience",19001,Cansano,Italiano,False,False,Italiano
9,Lawyer,Degree,28 - 40,17,"Procedural right, Negotiation","Argumentation, Persuasive communication",35004,Cerignola,Cinese,False,False,"Cinese, Italiano"
10,Marketing manager,Bachelor D.,47 - 54,15,"Management of the brand, Strategies of marketing, Planning of campaigns","Ability to adapt to new technologies, Creativity, Management of the team, Adaptability",72489,Trevenzuolo,Norvegese,True,True,"Norvegese, Italiano"
11,Architectural engineer,Bachelor D.,35 - 38,0,"ANSYS, Design","Troubleshooting, Management of time, Attention to detail, Decision-making capacity, Creativity",40005,Robilante,Italiano,True,True,"Italiano, Cinese, Argentino"
12,Marketing manager,Bachelor D.,38 - 47,11,"Market research, Strategies of marketing","Adaptability, Creativity",72504,San Massimo,Brasiliano,True,True,Brasiliano
13,Architectural engineer,Degree,32 - 43,11,"Simulink, AutoCAD, ANSYS, Solidworks, Design","Creativity, Communication, Management of time",39996,Marano sul Panaro,Inglese,True,False,Inglese
14,Architect,Bachelor D.,33 - 40,25,"Asana, Rhinoceros 3D, Coordination of the project, BIM","Effective communication, Collaboration, Attention to detail",42511,Piana Crixia,Francese,True,True,"Francese, Italiano"
15,System administrator,Researcher,38 - 44,10,"Linux, Network, Cloud management","Troubleshooting, Patience, Management of emergencies",37505,Castelfondo,Italiano,False,False,"Italiano, Israeliano, Statunitense"
16,Developer,Bachelor D.,22 - 35,10,"PHP, Java, Git","Retail aptitude, Professional Ethic, Innovation, Creativity",42995,Parenti,Inglese,True,False,Inglese
17,Surgeon,Degree,47 - 48,7,"Specialized surgical procedures, Surgical Anatomy, Medical imaging","Management of stress, Precision, Decision making, Ethics, Patience",79983,Strambinello,Irlandese,False,False,"Irlandese, Italiano, Italiano"
18,Data analyst,Bachelor D.,28 - 34,15,"Microsoft Excel, Tableau","Proactivity, Problem solving, Creativity",35006,Vialfre',Argentino,True,False,"Argentino, Inglese, Francese"
19,Doctor,Master D.,31 - 47,12,"Anatomy, Pharmacology, Management of patients, Therapy, Pathology","Teamwork, Ethics",52500,San Piero Patti,Lituano,False,False,"Lituano, Francese, Tunisino"
20,Pharmacist,Degree,39 - 53,8,"Preparation of drugs, Dispensing of drugs, Pharmacology, Control of prescriptions, Information on drugs","Organizational skills, Empathy",23502,Valle di Casies,Tedesco,False,False,"Tedesco, Francese, Venezuelano"
21,Operation manager,Degree,49 - 54,7,"Optimization of processes, Lean management ","Management of time, Troubleshooting, Strategic planning, Management of stress",109994,Isola Dovarese,Israeliano,True,True,"Israeliano, Portoghese, Francese"
22,Risk expert,Degree,39 - 43,10,"Environmental risk, Analysis of financial security policies, Management of the crisis, Assessment of risk, Management of losses","Analytical thinking, Management of stress, Decision making",35498,Camugnano,Italiano,False,False,Italiano
23,Therapist,Degree,41 - 42,8,"Ethics, Psychological evaluation","Confidentiality, Empathy, Active listening",23513,Pont-Canavese,Italiano,False,True,Italiano
24,Nurse,Bachelor D.,28 - 29,9,"Health care, Patient Management","Communication, Flexibility, Empathy, Management of stress, Organisation",30007,Azzano San Paolo,Norvegese,False,True,"Norvegese, Lituano"
25,Pharmacist,Degree,42 - 47,14,"Information on drugs, Pharmacology, Management of the cash, Preparation of drugs, Dispensing of drugs","Precision, Organizational skills, Communication, Empathy",23493,Rocca d'Evandro,Inglese,False,False,"Inglese, Italiano, Egiziano"
26,Developer,Bachelor D.,32 - 38,6,"Database, SQL, PHP, C++","Creativity, Collaboration, Retail aptitude, Flexibility",43003,Camerata Picena,Tedesco,True,True,Tedesco
27,Teacher,Degree,27 - 43,12,"Music, Geograpy, Art, Computer science","Empathy, Communication, Patience",18997,Grezzago,Messicano,False,False,"Messicano, Canadese, Italiano"
28,Legal consultant,PhD,36 - 39,12,"Criminal Law, Tax legislation, Intellectual property, Negotiation","Negotiation, Integrity, Customer orientation, Ethics",32484,Palestro,Italiano,False,False,"Italiano, Venezuelano"
29,Developer,Bachelor D.,25 - 33,10,"PHP, Operating systems, C++","Innovation, Retail aptitude, Problem solving, Creativity",42991,Brugnato,Colombiano,True,True,"Colombiano, Francese"
30,Computer security analyst,PhD,40 - 44,15,"Keepass, Analysis of vulnerabilities, GnuPG, Cryptography, Cyber Security","Troubleshooting, Innovation, Collaboration",79988,Castelleone,Italiano,True,True,"Italiano, Cinese, Pakistano"
31,Marketing manager,Degree,33 - 46,16,"Google Analytics, Strategies of marketing, Planning of campaigns, Hootsuite, CMS","Ability to adapt to new technologies, Management of the team, Creativity, Leadership, Critical thinking",72504,Montefusco,Italiano,True,False,"Italiano, Argentino, Irlandese"
32,Risk expert,Bachelor D.,40 - 46,3,"Financial risk, Data analysis","Management of stress, Analytical thinking, Decision making",35494,Pescara,Italiano,False,False,Italiano
33,Manager,Degree,41 - 45,20,"Negotiation, Team Management, Market expertise, Strategic planning","Leadership, Innovation, Analytical thinking, Adaptability",79995,Lequio Tanaro,Italiano,False,False,"Italiano, Danese"
34,Pharmacist,Bachelor D.,29 - 42,13,"Dispensing of drugs, Control of prescriptions, Pharmacology","Empathy, Precision, Communication, Attention to the customer",23485,Vaiano Cremasco,Cinese,False,True,"Cinese, Pakistano"
35,Developer,Bachelor D.,27 - 29,13,"Java, Algorithm","Collaboration, Innovation, Professional Ethic, Problem solving, Flexibility",42995,Vadena,Inglese,True,False,"Inglese, Turco"
36,Nurse,Bachelor D.,34 - 40,13,"Anatomy, Health care, Administration of drugs, Patient Management","Communication, Empathy, Professional ethics",29982,Sarsina,Canadese,False,False,Canadese
37,Surgeon,Bachelor D.,31 - 44,16,"Operating block management, General Surgery","Management of stress, Ethics",80000,San Massimo,Venezuelano,False,False,Venezuelano
38,Nurse specialist,Degree,25 - 30,11,"Administration of drugs, Specialized nursing assistance, Monitoring of patients","Empathy, Management of emergencies",42510,Falcade,Messicano,False,True,Messicano
39,System administrator,Master D.,33 - 41,9,"HTTP, Cloud management","Patience, Management of emergencies, Troubleshooting",37506,Massa Fermana,Italiano,False,True,"Italiano, Russo"
40,Surgeon,Degree,43 - 53,12,"General Surgery, Specialized surgical procedures, Operating block management, Surgical Anatomy, Medical imaging","Precision, Management of stress",80025,Decimoputzu,Tedesco,False,True,"Tedesco, Italiano"
41,Designer,Degree,23 - 24,4,"Sketch, Adobe After Effect, CorelDRAW","Innovation, Adaptability",35982,Valtopina,Russo,True,True,"Russo, Finlandese"
42,Asset manager,PhD,33 - 37,22,"Investments, Management of the portfolio, Financial planning, Financial analysis, Economics","Customer orientation, Attention to detail",44993,Foiano della Chiana,Italiano,False,False,Italiano
43,System administrator,Degree,32 - 39,4,"HTTP, Network, Linux","Management of emergencies, Troubleshooting, Patience",37492,Apecchio,Italiano,False,True,Italiano
44,Nurse,Master D.,27 - 50,9,"Anatomy, Patient Management, Medical emergencies, Health care","Organisation, Empathy, Management of stress",29980,Fontana Liri,Lituano,False,True,"Lituano, Messicano"
45,Financial consultant,Master D.,25 - 28,18,"Insurance, Actions, Economics","Empathy, Persuasive communication, Precision, Customer orientation, Attention to detail",40003,Brugnato,Francese,False,True,"Francese, Argentino, Tedesco"
46,Architectural engineer,Bachelor D.,34 - 40,6,"Solidworks, Design, Simulink, AutoCAD","Management of time, Leadership, Collaboration, Troubleshooting",39997,Carre',Italiano,True,True,"Italiano, Russo, Brasiliano"
47,Data analyst,PhD,28 - 42,2,"Tableau, Microsoft Excel, SQL","Creativity, Problem solving, Critical analysis",35011,Vedeseta,Brasiliano,True,False,"Brasiliano, Lituano"
48,Doctor,PhD,41 - 52,5,"Pharmacology, Management of patients, Interpretation of the results","Ethics, Teamwork, Patience, Empathic communication, Attention to the patient",52482,Tavarnelle Val di Pesa,Italiano,False,True,Italiano
49,Doctor,Degree,48 - 59,9,"Prevention, Management of patients, Pharmacology, Interpretation of the results","Patience, Ethics, Teamwork, Attention to the patient",52503,Stigliano,Brasiliano,False,False,"Brasiliano, Italiano"
50,Lawyer,Degree,54 - 54,10,"Procedural right, Negotiation, Criminal Law, Legal system","Analytical skills, Argumentation",35006,Castelfranco Emilia,Italiano,False,False,"Italiano, Turco"
51,X-ray technician,Master D.,42 - 47,12,"Preparation of patients, Use of imaging equipment","Precision, Attention to detail, Empathy, Organizational skills",23503,Curno,Egiziano,False,False,"Egiziano, Norvegese, Lituano"
52,HR Consultant,Degree,35 - 46,5,"Organisational development, Industrial relations","Ability to listen, Coaching, Management of stress, Negotiation, Empathy",34985,Semestene,Italiano,True,True,Italiano
53,Lawyer,Bachelor D.,30 - 58,21,"Legal system, Legal Research, Negotiation","Critical thinking, Analytical skills, Argumentation, Persuasive communication, Communication skills",35005,Rocca Grimalda,Venezuelano,False,True,"Venezuelano, Turco, Cubano"
54,Data Scientist,Bachelor D.,27 - 40,9,"TensorFlow, PyTorch","Attention to detail, Teamwork",33004,Salussola,Italiano,True,False,"Italiano, Inglese"
55,Data analyst,PhD,31 - 38,9,"Database, Tableau","Proactivity, Critical analysis",35016,Cansano,Inglese,True,True,"Inglese, Israeliano"
56,X-ray technician,Degree,37 - 55,15,"Radiological safety, Preparation of patients, Use of imaging equipment, X-ray and scan reading","Confidentiality, Ethics",23500,Vadena,Norvegese,False,True,Norvegese
57,Web Developer,Degree,34 - 38,0,"PHP, Python","Problem solving, Flexibility, Innovation, Ability to manage stress, Teamwork",45010,San Damiano al Colle,Tedesco,True,False,"Tedesco, Italiano"
58,Legal consultant,Degree,37 - 48,18,"Intellectual property, Contracts","Integrity, Management of stress",32481,Moscazzano,Statunitense,False,True,Statunitense
59,Risk expert,Bachelor D.,30 - 34,3,"Analysis of financial security policies, Environmental risk, Management of losses","Management of stress, Analytical thinking, Decision making",35496,Viggiu',Tunisino,False,False,"Tunisino, Danese"
60,Market analyst,Bachelor D.,28 - 42,3,"Analysis of trends, Strategies of the market, Market research, Forecast, Models of business","Effective presentation, Customer orientation, Adaptability, Problem solving",38982,Costacciaro,Messicano,True,True,"Messicano, Inglese, Brasiliano"
61,Operation manager,Degree,34 - 42,12,"Lean management , Optimization of processes, Management of operations, Quality Control, ERP","Management of stress, Management of time, Troubleshooting, Strategic planning",109993,Moiano,Francese,True,False,Francese
62,HR Consultant,Bachelor D.,27 - 29,14,"Training and development, Analysis of data","Empathy, Negotiation",34987,Parenti,Italiano,True,True,"Italiano, Cubano"
63,Nurse specialist,Bachelor D.,36 - 40,12,"Monitoring of patients, Intensive Care Unit, Oncology","Management of emergencies, Organisation, Empathy",42499,Arnasco,Italiano,False,True,Italiano
64,Surgeon,Master D.,42 - 49,25,"Specialized surgical procedures, Medical imaging, Surgical physiology","Management of stress, Ethics",79996,Sassuolo,Inglese,False,True,"Inglese, Colombiano"
65,Financial analyst,Degree,38 - 39,2,"Investment, Economics, Economic Law, Financial analysis","Critical analysis, Effective communication, Attention to detail",33506,Sperlonga,Inglese,True,True,"Inglese, Venezuelano"
66,Legal consultant,Degree,37 - 38,20,"Contracts, Negotiation, Intellectual property, Civil Law","Customer orientation, Negotiation, Management of stress",32495,Sant'Angelo Lodigiano,Russo,False,False,"Russo, Cubano, Cinese"
67,Architectural engineer,Master D.,26 - 39,5,"Simulink, Design, Structural analysis","Leadership, Decision-making capacity",40012,Liscate,Italiano,True,False,"Italiano, Portoghese, Inglese"
68,Market analyst,Bachelor D.,35 - 43,1,"Forecast, Analysis of data, Market research, Strategies of the market, Models of business","Teamwork, Problem solving, Effective presentation, Critical thinking",39009,Vendone,Italiano,True,True,"Italiano, Tedesco"
69,Data Scientist,Master D.,32 - 33,14,"Machine Learning, TensorFlow, Statistical, PyTorch","Teamwork, Attention to detail, Analytical thinking",32973,Pasturana,Italiano,True,False,Italiano
70,Developer,Master D.,32 - 39,7,"Operating systems, Git, SQL, Python","Flexibility, Collaboration",42996,Campobello di Licata,Argentino,True,True,Argentino
71,Lawyer,Degree,28 - 46,1,"Civil Law, Procedural right, Negotiation, Legal Research, Legal system","Argumentation, Persuasive communication, Analytical skills, Critical thinking",34981,Barzana,Italiano,False,False,Italiano
72,Marketing manager,Degree,28 - 51,18,"Management of the brand, CMS, Strategies of marketing, Market research, Hootsuite","Management of the team, Critical thinking, Ability to adapt to new technologies",72506,Nusco,Italiano,True,False,"Italiano, Norvegese, Finlandese"
73,Pharmacist,Degree,28 - 37,16,"Pharmacology, Information on drugs, Preparation of drugs","Attention to the customer, Precision, Empathy, Communication",23496,Palestro,Italiano,False,True,"Italiano, Colombiano, Egiziano"
74,Financial consultant,Researcher,43 - 45,13,"Investments, Financial markets, Insurance, Actions, Commercial Law","Precision, Customer orientation, Attention to detail, Persuasive communication, Empathy",40010,San Pietro Clarenza,Francese,False,True,"Francese, Tedesco"
75,System administrator,PhD,26 - 33,2,"Cyber Security, SMTP, Windows Server","Patience, Management of emergencies",37503,Schio,Italiano,False,True,"Italiano, Inglese"
76,Pharmacist,Bachelor D.,28 - 40,4,"Pharmacology, Preparation of drugs","Empathy, Organizational skills",23497,Civitanova Marche,Inglese,False,True,Inglese
77,Lawyer,PhD,28 - 35,28,"Criminal Law, Procedural right, Negotiation, Legal system","Persuasive communication, Critical thinking, Communication skills",34990,Pont-Canavese,Italiano,False,False,Italiano
78,Operation manager,Master D.,33 - 47,24,"Optimization of processes, Quality Control","Management of stress, Management of time, Strategic planning, Troubleshooting",109979,Bomporto,Tedesco,True,True,Tedesco
79,Marketing manager,Degree,34 - 35,15,"Google Analytics, CMS","Creativity, Management of the team",72496,Rivalta Bormida,Italiano,True,False,Italiano
80,Architectural engineer,Degree,28 - 39,18,"AutoCAD, Solidworks","Leadership, Troubleshooting",40000,Brendola,Messicano,True,True,"Messicano, Finlandese, Statunitense"
81,X-ray technician,Master D.,32 - 41,3,"Preparation of patients, Radiological safety, X-ray and scan reading, Use of imaging equipment","Ethics, Speed of learning, Organizational skills",23486,Valdengo,Cinese,False,True,Cinese
82,Market analyst,Bachelor D.,25 - 27,14,"Analysis of data, Analysis of competitors, Analysis of trends, Forecast, Market research","Teamwork, Adaptability",38987,Pojana Maggiore,Argentino,True,False,"Argentino, Italiano, Colombiano"
83,Operation manager,Master D.,40 - 44,22,"Microsoft Excel, ERP, Six Sigma, Optimization of processes, Management of operations","Strategic planning, Management of stress",110009,Montefusco,Israeliano,True,True,Israeliano
84,Market analyst,Researcher,25 - 34,12,"Analysis of competitors, Strategies of the market, Forecast, Analysis of data, Market research","Problem solving, Effective presentation",38997,Rivalba,Tunisino,True,False,Tunisino
85,Asset manager,Degree,42 - 42,12,"Investments, Investments","Strategic Thinking, Attention to detail, Customer orientation, Negotiation",44992,Curno,Italiano,False,True,"Italiano, Turco, Cubano"
86,System administrator,Degree,33 - 45,4,"Windows Server, Network, HTTP, SMTP, Cyber Security","Management of emergencies, Troubleshooting, Patience",37506,Decimoputzu,Turco,False,False,"Turco, Russo"
87,Financial analyst,Master D.,45 - 45,11,"Financial markets, Assessment of investments, Financial analysis","Management of stress, Attention to detail",33499,Lacco Ameno,Inglese,True,True,Inglese
88,Architect,Bachelor D.,38 - 49,3,"Vectorworks, Architectural design, BIM, Revit","Creativity, Collaboration, Spatial thought, Attention to detail, Effective communication",42499,Roncola,Inglese,True,False,"Inglese, Italiano, Italiano"
89,Marketing manager,Master D.,49 - 54,5,"CMS, Hootsuite, Management of the brand, Planning of campaigns","Adaptability, Creativity, Management of the team, Critical thinking, Leadership",72485,Ventotene,Inglese,True,True,"Inglese, Italiano"
90,Teacher,Bachelor D.,34 - 40,11,"Gym, Art, Sciences, Chemistry, Office suite","Communication, Empathy, Patience",19012,Cornaredo,Italiano,False,False,"Italiano, Russo"
91,Nurse specialist,Degree,30 - 50,4,"Intensive Care Unit, Oncology, Specialized nursing assistance, Administration of drugs","Management of emergencies, Organisation, Empathy",42506,Pietra Ligure,Norvegese,False,False,"Norvegese, Tedesco, Italiano"
92,Market analyst,Degree,27 - 40,0,"Analysis of data, Models of business, Analysis of trends","Adaptability, Customer orientation, Critical thinking, Problem solving",38994,Piovera,Italiano,True,True,"Italiano, Francese"
93,Operation manager,Bachelor D.,38 - 52,12,"Microsoft Excel, Optimization of processes, Lean management , ERP, Logistics","Troubleshooting, Strategic planning, Management of stress, Management of time",110003,Borgo Velino,Norvegese,True,False,Norvegese
94,Marketing manager,Degree,36 - 39,19,"Strategies of marketing, Google Analytics, CMS, Market research, Hootsuite","Creativity, Management of the team",72485,Pasturana,Colombiano,True,True,"Colombiano, Inglese"
95,Computer security analyst,PhD,32 - 45,8,"Cyber Security, Keepass, Cryptography","Critical thinking, Adaptability, Troubleshooting, Innovation, Collaboration",80005,Casalattico,Inglese,True,True,"Inglese, Italiano"
96,Therapist,Bachelor D.,28 - 44,30,"Ethics, Cognitive behavioral therapy, Psychological evaluation, Theories of Behavior, Psychopharmacology","Ethics, Empathy",23495,Valdengo,Messicano,False,True,Messicano
97,Asset manager,Bachelor D.,43 - 54,9,"Investments, Investments, Economics","Strategic Thinking, Attention to detail, Negotiation",45009,Casalattico,Portoghese,False,True,"Portoghese, Francese, Italiano"
98,Operation manager,PhD,30 - 42,11,"Quality Control, Six Sigma, Optimization of processes, Logistics","Management of stress, Management of time",109999,Castellabate,Lituano,True,True,"Lituano, Francese, Portoghese"
99,Operation manager,Master D.,42 - 53,17,"Microsoft Excel, Quality Control","Strategic planning, Management of stress, Management of time, Troubleshooting",110009,Pratovecchio Stia,Canadese,True,False,"Canadese, Russo"
