qId,Job,metadata,Edu_essential,Edu_optional,AgeMin,AgeMax,City,Competence_essential0,Competence_essential1,Competence_essential2,Competence_essential3,Competence_optional0,Competence_optional1,Competence_optional2,Knowledge_essential0,Knowledge_essential1,Knowledge_essential2,Knowledge_essential3,Knowledge_optional0,Knowledge_optional1,Knowledge_optional2,Language_essential0,Language_essential1,Language_optional0,Language_level0,Language_level1,Language_level2,Experience_essential,Experience_optional
75,veneer grader,{'group': '7543'},Degree,-,19,36,Motta di Livenza,prepare samples for testing,oversee quality control,distinguish wood quality,-,revise quality control systems documentation,liaise with managers,-,quality standards,quality assurance methodologies,-,-,manufacturing processes,-,-,Italian,-,-,Any,-,-,1,True
76,paper bag machine operator,{'group': '8143'},Degree,Bachelor-D.,19,39,Carpi,set up the controller of a machine,perform test run,monitor conveyor belt,adjust paper bag machine,remove excess glue,-,-,quality standards,packaging processes,-,-,types of paper,sizes of paper,-,Italian,English,French,Any,Any,Any,2,True
77,blow moulding machine operator,{'group': '8142'},Less-than-degree,Degree,16,36,Monte Argentario,use personal protection equipment,trim excess material,monitor gauge,monitor automated machines,report defective manufacturing materials,operate lifting equipment,-,plastic resins,blow moulding machine parts,-,-,types of moulding,mechanics,-,Spanish,Bengali,-,C1,A2,-,1,True
78,environmental technician,{'group': '2133'},Master-D.,PhD,25,37,Valdagno,report on environmental issues,document analysis results,-,-,-,-,-,metrology,laboratory techniques,environmental legislation,chemistry,-,-,-,German,English,French,Any,Any,Any,3,True
79,mine planning engineer,{'group': '2146'},Master-D.,PhD,27,43,Buonabitacolo,schedule mine production,prepare scientific reports,maintain plans of a mining site,interface with anti-mining lobbyists,assess operating cost,-,-,mining engineering,impact of geological factors on mining operations,geology,-,minerals laws,mine safety legislation,-,German,French,-,C2,Any,-,5,False
80,oceanographer,{'group': '2114'},Degree,-,18,38,San Pietro in Casale,synthesise information,operate scientific measuring equipment,evaluate research activities,-,perform laboratory tests,perform diving interventions,conduct underwater surveys,oceanography,mathematics,geology,-,geophysics,geographic information systems,cartography,Italian,-,-,Any,-,-,2,False
81,train conductor,{'group': '5112'},Less-than-degree,-,18,34,Alba,operate railway communication systems,answer questions about the train transport service,-,-,use different communication channels,act reliably,-,railway framework legislation,passenger transport regulations,customs regulations for passengers,-,-,-,-,Spanish,English,-,A2,C2,-,-,False
82,bank account manager,{'group': '3312'},Master-D.,PhD,29,35,Verona,provide financial product information,follow company standards,analyse financial performance of a company,-,-,-,-,financial statements,corporate social responsibility,banking activities,-,-,-,-,Italian,English,Bengali,B1,Any,Any,3,False
83,import export manager in textile industry machinery,{'group': '1324'},Master-D.,-,25,37,Forli,produce sales reports,manage processes,direct distribution operations,comprehend financial business terminology,-,-,-,textile industry machinery products,international import export regulations,international commercial transactions rules,export regulations of dual-use goods,-,-,-,Italian,-,German,B2,-,Any,-,False
84,travel and tourism vocational teacher,{'group': '2320'},Master-D.,PhD,29,41,Porto San Giorgio,deliver presentations on tourism,assess students,adapt training to labour market,-,manage resources for educational purposes,assess an area as a tourism destination,-,geographical areas relevant to tourism,customer service,-,-,learning difficulties,environmental impact of tourism,disability types,Spanish,German,Italian,B2,A1,Any,1,False
85,optical engineer,{'group': '2149'},Master-D.,PhD,29,44,Telese Terme,develop optical test procedures,conduct quality control analysis,conduct literature research,adjust engineering designs,use CAD software,perform scientific research,apply blended learning,types of optical instruments,optical manufacturing process,optical engineering,design drawings,microsensors,lasers,cavity optomechanics,Italian,English,French,Any,A1,Any,1,False
86,insurance claims handler,{'group': '3315'},Bachelor-D.,-,26,32,Santa Caterina Villarmosa,organise a damage assessment,handle incoming insurance claims,communicate with beneficiaries,-,handle customer complaints,analyse financial risk,-,insurance law,claims procedures,actuarial science,-,statistics,insurance market,-,Chinese,-,English,C1,-,Any,1,True
87,import export specialist in textile industry machinery,{'group': '3331'},Master-D.,-,29,35,Venezia,plan transport operations,have computer literacy,build rapport with people from different cultural backgrounds,apply conflict management,-,-,-,textile industry machinery products,international import export regulations,import export regulations of dangerous chemicals,embargo regulations,-,-,-,English,-,-,Any,-,-,3,False
88,gear machinist,{'group': '7223'},Less-than-degree,Degree,21,38,Monselice,perform test run,monitor automated machines,-,-,tend surface grinding machine,-,-,types of metal,mechanics,-,-,-,-,-,French,English,-,B1,Any,-,1,True
89,textile quality technician,{'group': '3119'},Master-D.,-,25,35,Meldola,use textile finishing machine technologies,distinguish fabrics,control textile process,-,manufacture staple yarns,manufacture non-woven filament products,-,textile technologies,textile printing technology,properties of fabrics,braiding technology,-,-,-,English,-,Spanish,A1,-,Any,-,False
90,real estate leasing manager,{'group': '3334'},Degree,-,23,38,Pescasseroli,enforce financial policies,analyse insurance risk,-,-,manage contracts,analyse market financial trends,advise on investment,real estate market,financial analysis,-,-,financial management,concurrent estate,building codes,Italian,English,-,C2,B2,-,2,True
91,dressmaker,{'group': '7531'},Degree,-,19,25,Pinarolo Po,measure the human body for wearing apparel,manufacture wearing apparel products,draw sketches to develop textile articles using softwares,distinguish fabrics,pleat fabrics,decorate textile articles,create patterns for garments,standard sizing systems for clothing,e-tailoring,buttonholing,-,mass customisation,CAD for garment manufacturing,-,French,English,-,B1,Any,-,3,False
92,colonel,{'group': '0110'},Degree,Bachelor-D.,18,26,Caltanissetta,maintain operational communications,advise superiors on military operations,-,-,monitor military equipment use,ensure compliance with types of weapons,analyse potential threats against national security,military weaponry,military code,geographic information systems,-,investigation research methods,camouflage,-,Italian,German,-,Any,Any,-,-,False
93,braiding machine operator,{'group': '8159'},Degree,-,21,36,Siniscola,manufacture ornamental braided cord,maintain work standards,evaluate textile characteristics,-,-,-,-,textile technologies,textile techniques,manufacturing industrial braids,braiding technology,textile materials,-,-,Spanish,Albanian,Italian,C1,A2,Any,2,False
94,dip tank operator,{'group': '8122'},Less-than-degree,-,21,33,Schio,wear appropriate protective gear,remove processed workpiece,remove inadequate workpieces,ensure equipment availability,distinguish lumber categories,consult technical resources,-,quality standards,industrial paint,health and safety in the workplace,dip tank parts,manufacturing of light metal packaging,-,-,English,-,French,C1,-,Any,3,False
95,fur animals breeder,{'group': '6129'},Less-than-degree,Degree,16,28,Gavirate,slaughter fur animals,select livestock,manage animal biosecurity,-,work with veterinarians,assess management of animals,advise on animal purchase,animal welfare legislation,animal nutrition,-,-,computerised feeding systems,animal welfare,-,Spanish,-,-,Any,-,-,-,False
96,bathroom fitter,{'group': '7126'},Degree,-,23,31,Verona,use shims,use measurement instruments,replace faucets,-,work in a construction team,place mirrors,keep personal administration,types of toilets,types of piping,types of bath tubs,-,vehicle cargo capacity,-,-,Italian,English,French,C2,Any,Any,3,False
97,electrical engineer,{'group': '2151'},Master-D.,-,28,37,Verona,define energy profiles,approve engineering design,abide by regulations on banned materials,-,train employees,provide technical documentation,process customer requests based on the REACh Regulation 1907 2006,environmental threats,environmental legislation,engineering principles,electricity,microassembly,mechatronics,electric heating systems,English,-,-,B2,-,-,3,True
98,floor and wall coverings shop manager,{'group': '1420'},Degree,Bachelor-D.,22,35,Rovello Porro,supervise merchandise displays,set sales goals,monitor customer service,apply health and safety standards,-,-,-,wall and floor coverings industry,sales activities,-,-,-,-,-,Spanish,French,-,B2,C1,-,4,False
99,textile industry machinery distribution manager,{'group': '1324'},Degree,-,22,30,Paterno,perform risk analysis,minimise shipping cost,manage financial risk,-,-,-,-,textile industry machinery products,supply chain management,hazardous freight regulations,-,-,-,-,Italian,Arabic,-,A1,Any,-,1,True
100,process metallurgist,{'group': '2146'},Master-D.,PhD,29,34,Trapani,troubleshoot,manipulate metal,-,-,-,-,-,types of metal manufacturing processes,metal forming technologies,-,-,precious metals,innovation processes,chemical processes,German,-,French,A2,-,Any,4,False
101,political scientist,{'group': '2633'},Less-than-degree,Degree,17,33,Camisano,think abstractly,operate open source software,manage intellectual property rights,-,perform public relations,analyse election procedures,advise on foreign affairs policies,politics,political ideologies,-,-,international law,election law,-,Italian,English,-,C1,A2,-,1,False
102,taxi driver,{'group': '8322'},Degree,Bachelor-D.,22,42,Venezia,use different communication channels,read maps,operate radio dispatch systems for taxis,-,perform services in a flexible manner,adapt to changing situations,-,mechanical components of vehicles,effective perception of transport environment,-,-,-,-,-,Italian,Chinese,German,Any,C2,Any,2,False
103,mattress making machine operator,{'group': '8159'},Less-than-degree,-,20,30,Lucera,sew textile-based articles,operate furniture machinery,-,-,maintain furniture machinery,-,-,upholstery tools,textile materials,functionalities of machinery,-,furniture trends,furniture industry,-,Italian,French,-,Any,Any,-,2,False
104,naval architect,{'group': '2144'},Master-D.,-,24,39,San Cataldo,execute feasibility study,ensure vessel compliance with regulations,assess financial viability,-,-,-,-,mechanical engineering,engineering processes,engineering principles,-,-,-,-,English,-,-,C1,-,-,-,False
105,employment and vocational integration consultant,{'group': '2423'},Bachelor-D.,-,23,41,Pagani,listen actively,document interviews,-,-,write work-related reports,organise training,apply knowledge of human behaviour,online job platforms,labour legislation,-,-,market analysis,advertising techniques,-,Italian,-,German,C1,-,Any,1,True
106,hydroelectric plant operator,{'group': '3131'},Master-D.,PhD,28,34,Bordighera,wear appropriate protective gear,operate hydraulic pumps,operate hydraulic machinery controls,-,liaise with engineers,ensure equipment maintenance,-,hydroelectricity,electricity,electrical power safety regulations,electric generators,-,-,-,Russian,Italian,-,Any,B1,-,3,True
107,corrosion technician,{'group': '3112'},Master-D.,-,28,41,Calcinaia,inspect pipelines,execute analytical mathematical calculations,-,-,keep records of work progress,conduct soil sample tests,-,types of pipelines,mathematics,-,-,analytical chemistry,-,-,Spanish,-,-,B2,-,-,2,False
108,nonwoven filament machine operator,{'group': '8131'},Less-than-degree,Degree,19,29,Afragola,manufacture textile floor coverings,control textile process,-,-,-,-,-,textile chemistry,nonwoven machine technology,-,-,textile industry,-,-,Italian,English,-,B1,A2,-,2,True
109,zoo curator,{'group': '1431'},Degree,-,18,34,Taranto,manage zoo staff,manage supplies,liaise with local authorities,ensure health and safety of visitors,-,-,-,zoo regulations,applied zoology,animal breeding programmes,animal acquisition,zoo exhibit design,animal transport regulations,-,Spanish,French,-,A2,A1,-,4,True
110,electromagnetic engineer,{'group': '2151'},Master-D.,PhD,24,31,Mantova,report analysis results,manage research data,approve engineering design,-,-,-,-,electricity,consumer protection,-,-,transmission technology,radars,acoustics,French,English,-,C2,Any,-,-,False
111,upsetting machine operator,{'group': '7223'},Degree,Bachelor-D.,23,31,Lecce,supply machine,ensure correct metal temperature,-,-,operate forging tongs,monitor conveyor belt,-,types of upsetting machines,types of metal,-,-,types of metal manufacturing processes,manufacturing of door furniture from metal,-,German,-,-,C1,-,-,-,False
112,civil engineering worker,{'group': '9312'},Less-than-degree,-,17,23,Riano,prepare subgrade for road pavement,perform drainage work,operate drones in civil engineering,-,-,-,-,road traffic laws,excavation techniques,compaction techniques,-,construction methods,-,-,Italian,English,-,Any,Any,-,2,False
113,radio technician,{'group': '7422'},Degree,Bachelor-D.,20,26,Verona,install electronic communication equipment,calibrate electronic instruments,-,-,install low voltage wiring,implement a virtual private network,-,electronics principles,analog electronics theory,-,-,microwave principles,-,-,German,Arabic,-,Any,B1,-,-,False
114,mortgage broker,{'group': '3311'},Master-D.,PhD,28,42,Novara,manage loan applications,decide on loan applications,collect property financial information,assess mortgage risk,synthesise financial information,consult credit score,communicate with banking professionals,property law,credit control processes,actuarial science,-,-,-,-,Italian,Arabic,Chinese,Any,B2,Any,1,False
115,froth flotation deinking operator,{'group': '8171'},Bachelor-D.,Master-D.,21,40,Villasanta,use deinking chemicals,set up the controller of a machine,concentrate pulp slurry,-,-,-,-,types of pulp,types of paper,quality standards,deinking processes,types of bleach,-,-,Spanish,-,Italian,Any,-,Any,-,False
116,house builder,{'group': '7111'},Less-than-degree,Degree,18,23,Vanzago,seal flooring,plan construction of houses,follow health and safety procedures in construction,-,-,-,-,roofing techniques,building materials industry,building codes,-,-,-,-,English,-,French,A1,-,Any,5,True
117,alternative fuels engineer,{'group': '2149'},Master-D.,PhD,26,45,Nettuno,execute feasibility study on hydrogen,dispose of hazardous waste,design electrical systems,-,prevent sea pollution,inspect engine rooms,ensure aircraft compliance with regulation,systems development life-cycle,smart grids systems,fuel gas,environmental legislation,battery fluids,aviation English,-,French,-,-,C2,-,-,1,False
118,fleet commander,{'group': '0110'},Degree,-,23,33,Vignate,supervise crew,analyse ship operations,-,-,-,-,-,navy operations,military code,-,-,ship related legislative requirements,military weaponry,maritime law,French,-,Italian,Any,-,Any,1,False
119,precious stone cutter,{'group': '7313'},Less-than-degree,Degree,17,22,Casalmaggiore,ensure conformance to jewel design specifications,calculate value of gems,-,-,develop jewellery designs,adjust jewellery,-,jewellery processes,gem cutting forms,characteristics of diamonds,-,wet tumbling,jewellery product categories,coining,Italian,French,English,C2,C2,Any,-,False
