qId,Job,metadata,Edu_essential,Edu_optional,AgeMin,AgeMax,City,Competence_essential0,Competence_essential1,Competence_essential2,Competence_essential3,Competence_optional0,Competence_optional1,Competence_optional2,Knowledge_essential0,Knowledge_essential1,Knowledge_essential2,Knowledge_essential3,Knowledge_optional0,Knowledge_optional1,Knowledge_optional2,Language_essential0,Language_essential1,Language_optional0,Language_level0,Language_level1,Language_level2,Experience_essential,Experience_optional
71,healthcare inspector,{'group': '3257'},Bachelor-D.,-,23,43,Laives,ensure safety of healthcare users,conduct workplace audits,advise on risk management,-,present reports,identify hazards in the workplace,-,medical terminology,medical studies,"health, safety and hygiene legislation",health care system,infection control,-,-,Spanish,English,-,Any,B1,-,-,False
72,railway sales agent,{'group': '4221'},Master-D.,PhD,26,42,Lendinara,handle petty cash,communicate with customers,-,-,-,-,-,product range of railway companies,geographic areas,-,-,-,-,-,Spanish,-,English,B1,-,Any,5,False
73,dental instrument assembler,{'group': '8212'},Less-than-degree,Degree,21,26,Taranto,manufacture dental instruments,follow clinical guidelines,clean components during assembly,-,repair dental instruments,keep records of work progress,dispose of hazardous waste,quality standards,medical device regulations,-,-,electronics,-,-,Spanish,German,English,C1,C2,Any,-,False
74,mine production manager,{'group': '1322'},Master-D.,PhD,26,36,Sant'Angelo a Scala,plan medium to long term objectives,advise on mine equipment,-,-,prepare scientific reports,-,-,mining engineering,mine safety legislation,electricity,-,-,-,-,Spanish,-,-,B2,-,-,2,False
75,chief data officer,{'group': '1330'},Degree,-,21,35,Carolei,manage ICT data architecture,define data quality criteria,-,-,report analysis results,manage business knowledge,integrate ICT data,visual presentation techniques,data mining,business processes,-,online analytical processing,PostgreSQL,MDX,English,-,-,B1,-,-,2,True
76,chimney sweep supervisor,{'group': '7133'},Less-than-degree,-,16,27,Mascalucia,maintain relationship with customers,evaluate ventilation system,-,-,-,-,-,HVAC systems,personal protective equipment,domestic heating systems,-,energy performance of buildings,construction product regulation,-,French,-,-,B2,-,-,3,False
77,printing textile technician,{'group': '7322'},Master-D.,PhD,25,34,Rio Saliceto,maintain work standards,design yarns,control textile process,conduct textile testing operations,prepare equipment for textile printing,develop textile colouring recipes,-,textile printing technology,textile chemistry,dyeing technology,-,-,-,-,Italian,French,-,Any,Any,-,2,False
78,animal trainer,{'group': '5164'},Degree,-,22,42,Fumane,provide first aid to animals,ensure animals receive physical exercise that meets their needs,design training programmes for individuals and animals,-,elect animals for training,manage challenging circumstances in the veterinary sector,estimate financial needs,legislation when working with animals,animal welfare needs,-,-,-,-,-,Italian,English,-,B1,Any,-,4,False
79,pricing specialist,{'group': '2431'},Degree,-,21,29,Torino,identify pricing opportunities,comprehend  business finance terminology,-,-,be computer-literate,build business relationships,-,data mining methods,company policies,-,-,-,-,-,Arabic,-,-,B1,-,-,1,False
80,cigar inspector,{'group': '7543'},Degree,-,18,32,Nocera Inferiore,apply requirements concerning manufacturing of food and beverages,apply GMP,-,-,have computer literacy,act reliably,-,quality prototype of a tobacco leaf,manufacturing of smoked tobacco products,-,-,tobacco products,-,-,Spanish,Chinese,-,Any,C2,-,2,True
81,ship captain,{'group': '3152'},Degree,-,20,37,Trani,guide ships,utilise mechanical equipment on ships,ensure public health and safety,ensure ongoing compliance with regulations,endure atypical working conditions,comply with checklists,apply transportation management concepts,principles of mechanical engineering,freight transport methods,-,-,fundamentals of warehouse operations,-,-,English,-,-,Any,-,-,1,False
82,confectionery specialised seller,{'group': '5223'},Degree,Bachelor-D.,22,37,Valdagno,organise storage facilities,issue sales invoices,examine merchandise,-,-,-,-,product comprehension,food colorants,e-commerce systems,characteristics of products,-,-,-,Italian,French,Spanish,Any,Any,Any,-,False
83,band saw operator,{'group': '8172'},Degree,-,23,28,Gonzaga,repair sawing blade on machine,operate a wood saw,-,-,-,-,-,type of wood,types of sawing blades,hi tech cutting,-,manufacturing of furniture,manufacturing of daily use goods,-,Italian,French,-,A1,A1,-,1,True
84,textile specialised seller,{'group': '5223'},Degree,-,20,27,Collinas,provide customer guidance on product selection,carry out active selling,-,-,measure yarn count,-,-,product comprehension,characteristics of services,-,-,textile trends,textile industry,braiding technology,Chinese,-,-,B2,-,-,1,False
85,embedded systems security engineer,{'group': '2529'},Master-D.,PhD,27,44,Comacchio,keep up with the latest information systems solutions,identify ICT system weaknesses,execute software tests,define security policies,perform project management,integrate system components,-,information security strategy,cyber attack counter-measures,-,-,organisational resilience,cloud technologies,ICT encryption,Russian,-,-,Any,-,-,2,True
86,research and development manager,{'group': '1223'},Master-D.,PhD,28,48,Pozzuoli,represent the organisation,perform project management,-,-,develop product policies,contact scientists,apply blended learning,project management,marketing principles,intellectual property law,-,marketing management,-,-,Spanish,Italian,-,C1,B1,-,-,False
87,statistical assistant,{'group': '3314'},Master-D.,PhD,24,41,Lucera,write work-related reports,implement data analysis,-,-,produce statistical financial records,carry out financial surveys,carrying out a statistical forecast,statistical analysis system software,field of mathematics,-,-,-,-,-,Italian,-,-,B2,-,-,-,False
88,chemistry technician,{'group': '3111'},Master-D.,PhD,29,46,Supino,write work-related reports,data processing,industrial chemical handling,-,-,-,-,range of health and safety standards,chemical products,dispergation processing.,ethanol,analytical spectrometry,-,-,Spanish,-,-,Any,-,-,-,False
89,drawing artist,{'group': '2651'},Less-than-degree,Degree,16,36,Caserta,use digital illustration techniques,select subject matter,-,-,present exhibition,plan art educational activities,participate in artistic mediation activities,labour legislation,intellectual property law,art history,-,-,-,-,German,-,English,Any,-,Any,4,False
90,ship steward/ship stewardess,{'group': '5111'},Less-than-degree,Degree,18,28,Torino,handle veterinary emergencies,handle financial transactions,check passenger tickets,-,provide first aid,give instructions to staff,distribute local information materials,on board hazards,health and safety measures in transportation,-,-,physical parts of the vessel,-,-,English,Chinese,French,Any,C2,Any,-,False
91,biometrician,{'group': '2120'},Master-D.,PhD,29,34,San Miniato,publish academic research,mentor individuals,execute analytical mathematical calculations,conduct research across disciplines,gather experimental data,develop scientific theories,-,scientific research methodology,mathematics,biometrics,-,biology,-,-,Spanish,-,-,A2,-,-,1,True
92,rail maintenance technician,{'group': '3112'},Master-D.,PhD,28,44,Pimonte,test sensors,maintain sensor equipment,detect faults through analysis of rail-flaw-detection machine recordings,detect rail track malfunctions,-,-,-,mechanics of trains,engineering mechanics,fundamentals of electricity,physics of wheel rail interface,international railway network law,rail wheel temperature sensor,electrical systems used in transportation,Italian,-,-,Any,-,-,5,False
93,ICT research consultant,{'group': '2511'},Degree,-,22,42,Cupra Marittima,provide user documentation,evaluate research activities,create prototype of user experience solutions,conduct literature research,provide multimedia content,perform data mining,-,scientific research methodology,innovation processes,-,-,XQuery,LINQ,-,German,-,-,Any,-,-,1,True
94,"rental service representative in other machinery, equipment and tangible goods",{'group': '5249'},Less-than-degree,Degree,20,28,Torino,perform multiple tasks at the same time,manage claims process,communicate with customers,-,-,-,-,product comprehension,financial capability,company policies,-,-,-,-,English,-,-,Any,-,-,1,True
95,human rights officer,{'group': '2619'},Bachelor-D.,Master-D.,21,41,Lainate,facilitate official agreement,build collective relations,advise on legal decisions,-,promote social changes,-,-,social justice,process of scientific research,international human rights law,-,political science,multi national rules,court procedures,French,-,-,A1,-,-,-,False
96,welding coordinator,{'group': '7212'},Degree,Bachelor-D.,21,28,Torino,supervising staff,cooperate with managers,inspect quality of products,coordinate communication within a team,monitor manufacturing quality standards,-,-,soldering and bonding skills,types of metal,flammable fluids,-,-,-,-,Italian,German,-,B2,Any,-,-,False
97,digital games tester,{'group': '2519'},Degree,-,20,30,Gaeta,report test findings,replicate customer software issues,provide software testing documentation,execute software tests,-,-,-,software anomalies,digital game genres,-,-,XQuery,-,-,Spanish,Arabic,-,Any,C1,-,-,False
98,leather wet processing department manager,{'group': '1321'},Master-D.,PhD,27,45,Palo del Colle,monitor operations in the leather industry,identify with the company's goals,exert a goal-oriented leadership role towards colleagues,-,liaise with colleagues,-,-,physico-chemical properties of hides and skins,health and safety in the workplace,functionalities of machinery,-,-,-,-,Italian,-,-,C2,-,-,-,False
99,fire commissioner,{'group': '1112'},Master-D.,-,29,41,Tortorici,perform maintenance on fire alarm systems,ensure equipment availability,conduct fire safety inspections,-,train employees,advise on government policy compliance,-,fire safety regulations,building codes,-,-,fire-fighting systems,-,-,Spanish,Italian,-,B2,Any,-,1,False
100,court jury coordinator,{'group': '2619'},Master-D.,PhD,29,44,Forlimpopoli,provide legal advice,observe confidentiality,complying with legal regulations,engage with jury,-,-,-,legal case management,court procedures,-,-,legal probing,techniques for consultation,civil process order,Spanish,Italian,-,Any,C1,-,4,False
101,artistic painter,{'group': '2651'},Degree,-,18,34,Bagno a Ripoli,learn artistic techniques,select artistic materials to create artworks,-,-,submit preliminary artwork,study artworks,plan art educational activities,employment legislation,intellectual property law,art history,-,-,-,-,Italian,French,-,C1,A2,-,2,True
102,news anchor,{'group': '2656'},Master-D.,PhD,27,36,Caserta,read pre-drafted texts,follow the news,develop professional network,-,operate audio equipment,check stories,adopt a relaxed posture,spelling,breathing techniques,audiovisual equipment,-,-,-,-,Italian,-,-,Any,-,-,2,False
103,clothing specialised seller,{'group': '5223'},Less-than-degree,Degree,18,28,Torino,identify customer's needs,demonstrate products' features,-,-,adjust clothes,-,-,sales argumentation,product comprehension,clothing sizes,characteristics of services,clothing industry,-,-,Italian,-,-,Any,-,-,-,False
104,stringed musical instrument maker,{'group': '7312'},Degree,Bachelor-D.,20,38,Salerno,restore musical instruments,maintain musical instruments,decorate musical instruments,apply a protective layer,estimate restoration costs,-,-,organic building materials,metalworking,-,-,sales promotion techniques,conservation techniques,3D modelling,Spanish,-,-,C2,-,-,2,False
105,head sommelier,{'group': '5131'},Degree,-,22,40,Bibbona,schedule shifts,managed medium term objectives,ensure regular maintenance of kitchen equipment,compile wine lists,-,-,-,wine related sciences,wine character,wine type,fizzy wines,-,-,-,Italian,German,-,C1,Any,-,1,False
106,performance lighting director,{'group': '2654'},Degree,-,23,38,Cavallino-Treporti,supervise lighting crew,analyse a script,-,-,-,-,-,technical drawings,personal directing styles,lighting techniques,health and safety regulations,-,-,-,Italian,-,-,C2,-,-,2,True
107,service manager,{'group': '1349'},Bachelor-D.,Master-D.,24,44,Torino,identify customer's needs,develop business plans,-,-,inform customers of activity changes,-,-,product comprehension,corporate social responsibility,-,-,-,-,-,Albanian,-,-,A1,-,-,-,False
108,religious education teacher at secondary school,{'group': '2330'},Master-D.,PhD,24,30,Verona,monitor student's behaviour,assess students,-,-,prepare youths for adulthood,aid in the organisation of school events,-,secondary school procedures,post-secondary school procedures,learning difficulties,curriculum objectives,-,-,-,French,English,-,A1,B2,-,5,True
109,ATM repair technician,{'group': '7421'},Degree,Bachelor-D.,23,32,Carpi,use repair manuals,removing a defective component,arrange customer information related to repairs,identify security threats,issuing a sales invoices,clean equipment,-,mechanical tools,features of electronics,automated teller machines,-,information confidentiality,-,-,Russian,English,-,B2,C2,-,1,False
110,"technical sales representative in hardware, plumbing and heating equipment",{'group': '2433'},Degree,Bachelor-D.,18,33,Sannazzaro de' Burgondi,use customer relationship management software,supervise sales activities,keep records on sales,ensure client orientation,-,-,-,sales promotion techniques,product comprehension,characteristics of services,characteristics of products,-,-,-,Italian,English,German,C1,C2,Any,5,False
111,epidemiologist,{'group': '2131'},Master-D.,PhD,24,30,Soleto,speak foreign languages,increase the impact of science on policy and society ,apply research ethics and scientific integrity principles in research activities,-,archive scientific documentation,-,-,statistics,public health,disease prevention in medicine,biometrics,professional documentation in health-care,-,-,German,English,-,A1,A2,-,1,False
112,animation director,{'group': '2654'},Less-than-degree,-,21,27,Adrano,perform project management,manage technical resources stock,manage staff,hire new personnel,-,-,-,multimedia systems,motion graphics,ICT software specifications,-,digital compositing,GIMP (graphics editor software),Adobe Photoshop,Spanish,Russian,-,Any,Any,-,2,False
113,finished leather warehouse manager,{'group': '1324'},Degree,Bachelor-D.,21,41,Frattamaggiore,use IT tools,manage quality of leather throughout the production process,-,-,review distribution management procedures,manage distribution channels,liaise with colleagues,quality control systems,health and safety in the workplace,-,-,physico-chemical properties of hides and skins,leather technology,leather finishing technologies,Italian,-,-,A1,-,-,-,False
114,aircraft engine tester,{'group': '3115'},Master-D.,PhD,26,45,Buccinasco,use technical documentation,document test data,formulate solutions to problems,-,-,-,-,engineering processes,engine components,electromechanics,-,-,-,-,Italian,-,-,Any,-,-,-,False
115,computer hardware engineer,{'group': '2152'},Bachelor-D.,Master-D.,24,44,Buccinasco,publish academic research,promote open innovation in research,demonstrate disciplinary expertise,-,train employees,install software,install operating system,mathematics,hardware architectures,-,-,quality standards,VBScript,Swift (computer programming),English,-,-,A2,-,-,-,False
116,economist,{'group': '2631'},Less-than-degree,-,21,39,Afragola,ensure corrected data storing,demonstrate disciplinary expertise,conduct quantitative research,-,-,-,-,fiscal laws,scientific research methodology,business management standards,-,-,-,-,French,English,-,A2,B2,-,1,False
117,plumber,{'group': '7126'},Degree,-,23,28,San Pietro Vernotico,use measurement instruments,preparing copper pipes for use as gas lines,drainpipe clearance,-,file records of work progress,cut wall chases,determine technological support mechanisms,types of piping,tools for plumbing,-,-,fluid pressure,types of heat pumps,-,Italian,-,Arabic,A2,-,Any,1,True
118,press and stationery specialised seller,{'group': '5223'},Less-than-degree,-,17,23,Torino,process refunds,issue sales invoices,-,-,find written press' issues,-,-,sales argumentation,characteristics of products,-,-,-,-,-,Chinese,-,-,Any,-,-,2,True
119,audio-visual technician,{'group': '3521'},Degree,-,23,34,Latina,operate video equipment,maintain electrical equipment,apply health and safety standards,-,-,-,-,audiovisual products,audiovisual equipment,-,-,photography,-,-,Spanish,French,-,C1,Any,-,1,True
120,agricultural inspector,{'group': '3359'},Degree,-,21,37,Torino,follow up complaint reports,enforce sanitation procedures,conduct environmental surveys,-,keep task records,-,-,sustainable agricultural production principles,pollution prevention,incidents and accidents recording,environmental legislation in agriculture and forestry,horticulture principles,agricultural chemicals,European pesticide legislation,Italian,French,-,Any,A1,-,-,False
121,"coffee, tea, cocoa and spices distribution manager",{'group': '1324'},Degree,Bachelor-D.,18,28,Camaiore,forecast distribution activities,adhere to organisational guidelines,-,-,-,-,-,supply chain management,hazardous freight regulations,freight transport methods,"coffee, tea, cocoa and spice products",-,-,-,Russian,Italian,-,B2,Any,-,-,False
122,cooper,{'group': '7522'},Degree,-,23,38,Morolo,clean wood surface,construct barrels,-,-,guard drilling machinery,recognise signs of wood rot,place a product order,wood moisture content,wood cuts,-,-,types of containers,metalworking tools,airtight storage,German,French,Spanish,B2,A1,Any,2,True
123,armoured car driver,{'group': '8322'},Degree,-,20,31,Mediglia,practice vigilance,maintain vehicle delivery documentation,enable regulatory compliance concerning distribution activities regulatory compliance concerning distribution activities,drive vehicles,-,-,-,security threats,regulations for road traffic,effective perception of transport environment,-,-,-,-,Italian,French,English,B1,A1,Any,-,False
124,"import export manager in hardware, plumbing and heating equipment and supplies",{'group': '1324'},Master-D.,PhD,24,42,Prata di Pordenone,ensure customs compliance,direct distribution operations,implement conflict management,-,-,-,-,international commercial transactions rules,import export regulation of a dangerous chemical,export regulations of dual-use goods,embargo regulations,-,-,-,Spanish,Chinese,-,B1,C1,-,-,False
125,manufacturing cost estimator,{'group': '2421'},Bachelor-D.,Master-D.,22,30,Torino,provide cost benefit analysis reports,execute analytical mathematical calculations,determine financial viability,-,perform activities for cost accounting,calculate materials to build equipment,assess work hours required to successfully complete a task,mathematics,manufacturing processes,-,-,-,-,-,Spanish,-,Italian,Any,-,Any,1,True
126,import export manager in china and other glassware,{'group': '1324'},Master-D.,PhD,26,46,Cittadella,speak a different language,formulate solutions to problems,apply conflict management,-,-,-,-,international import export regulations,international commercial transactions rules,glassware products,embargo regulation,-,-,-,Italian,English,-,B1,Any,-,1,True
127,acoustical engineer,{'group': '2149'},Master-D.,PhD,27,37,Padova,perform scientific research,adjust engineering designs,-,-,use sound measuring instruments,draft design specifications,create software design,engineering processes,engineering principles,acoustics,acoustical engineering,audio editing software,-,-,Italian,-,German,C2,-,Any,3,True
128,co-pilot,{'group': '3153'},Degree,-,20,40,Saint-Vincent,implement airside safety procedures,create a flight plan,apply transportation management concepts,-,write work-related reports,respond to changing navigation circumstances,carry out navigational calculations,visual flight rules,geographic areas,aircraft flight control systems,-,geostationary satellites,-,-,Italian,-,-,Any,-,-,-,False
129,editorial assistant,{'group': '3343'},Degree,Bachelor-D.,21,38,Venezia,use word processing software,manage information sources,-,-,use specific writing techniques,search databases,interview people,press law,linguistics,desktop publishing,database management systems,search engines,-,-,Russian,French,-,C1,A2,-,1,True
130,metal product quality control inspector,{'group': '7543'},Degree,-,21,29,Citta Sant'Angelo,spot metal imperfections,use calibrated analytical instruments,maintain test equipment,ensure public safety and security,record production data for quality control,work with grading party,-,quality assurance arrangements,manufacturing processes,-,-,statistical process control,metal smoothing technologies,metal coating mechanisation,Spanish,Chinese,French,B2,Any,Any,-,False
131,learning mentor,{'group': '2359'},Master-D.,-,27,41,Taglio di Po,listen actively,consult student's support system,-,-,identify education needs,-,-,learning needs analysis,learning difficulties,communication disorders,-,-,-,-,Spanish,English,German,Any,C2,Any,4,False
132,educational counsellor,{'group': '2359'},Master-D.,PhD,27,44,San Giovanni in Marignano,tackle issues that block academic progress,monitor student's behaviour,liaise with educational staff,-,show consideration for student's situation,provide information on education financing,maintain relations with children's parents,learning needs analysis,learning difficulties,counselling methods,-,psychology,psychological counselling methods,post-secondary school procedures,Italian,French,German,C2,A2,Any,4,False
133,nurse assistant,{'group': '5321'},Less-than-degree,Degree,18,25,Novara,provide professional care in nursing,follow clinical guidelines,-,-,use of electronic health records in nursing,promote a positive image of nursing,perform venous cannulation ,nursing principles,health care legislation,-,-,pharmacology,innovation in nursing,science of human physiology,Italian,-,-,Any,-,-,1,False
134,textile colourist,{'group': '2163'},Degree,Bachelor-D.,21,36,Torino,use textile techniques for hand-made goods,maintain work standards,develop textile articles through drawing,-,-,-,-,project portfolio organisation and development,dyeing technology,-,-,marketing techniques,-,-,Italian,-,-,B1,-,-,1,True
135,furniture restorer,{'group': '7522'},Degree,-,22,36,Carpi,select restoration activities,document rejuvenation,apply restoration methods,-,produce customised tools,decorate furniture,clean furniture,kinds of wood,a technical drawing,conservation techniques,art history,furniture industry,engraving technologies,-,French,English,-,A1,Any,-,3,True
136,EU funds manager,{'group': '1213'},Degree,-,20,27,Latina,decide on arranging funds,comply with legal regulations,-,-,prepare audit activities,carry out strategic research,-,government policy,fraud detection,-,-,socio-economic trends in your sector,risk management,microfinance,Spanish,French,-,C2,Any,-,3,False
137,footwear assembly supervisor,{'group': '3122'},Master-D.,PhD,27,40,Laives,use communication techniques,make use of leadership abilities for team coordination,-,-,reduce environmental impact of footwear industry,-,-,footwear quality standards,goodyear footwear construction techniques and processes,-,-,-,-,-,Italian,-,-,Any,-,-,1,True
138,ship assistant engineer,{'group': '3151'},Degree,-,18,23,Venezia,repair vessel mechanical systems,provide support in vessel machinery systems,perform routine lube oil tests,manage vessel engines and systems,advise on maritime regulations,-,-,engine components,Global Maritime Distress and Safety System,-,-,physics,maritime transportation technology,International Maritime Organisation conventions,German,French,Italian,Any,A1,Any,2,True
139,computer vision engineer,{'group': '2511'},Master-D.,PhD,27,39,Rocca San Felice,report analysis results,develop software mockup,-,-,perform data mining,design user interface,define data quality criteria,machine learning,Philasmicos Entwickler Studio,AWK,-,-,-,-,Italian,-,-,A2,-,-,1,False
140,public funding advisor,{'group': '2412'},Bachelor-D.,Master-D.,22,32,Medole,using consulting techniques,identify clients' needs,-,-,observe confidentiality,manage government-funded programmes,issue official documents,funding methods,business processes,-,-,-,-,-,Italian,French,English,C2,B2,Any,1,True
141,motor vehicle engine tester,{'group': '3115'},Master-D.,PhD,26,40,Bagno di Romagna,use testing equipment,use technical documentation,-,-,operate lifting equipment,-,-,operation of different engines,electromechanics,-,-,engineering principles,-,-,Italian,-,English,A2,-,Any,1,True
142,membranophone musical instruments maker,{'group': '7312'},Degree,-,19,33,Pozzuoli,produce drum components,maintain music instruments,assemble musical instrument parts,-,evaluate restoration procedures,-,-,organic building objects,musical instruments materials,metalworking,-,sales promotion methods,musical instrument accessories,conservation techniques,English,-,French,Any,-,Any,-,False
143,wicker furniture maker,{'group': '7317'},Less-than-degree,Degree,20,40,San Benedetto Ullano,monitor drilling machinery,apply weaving techniques for wicker furniture,-,-,furniture selling,join wooden elements,design prototypes,weaving technique for wicker,wicker materials,specialised drawings,furniture trend,-,-,-,Spanish,-,English,C1,-,Any,1,False
