qId,Job,metadata,Edu_essential,Edu_optional,AgeMin,AgeMax,City,Competence_essential0,Competence_essential1,Competence_essential2,Competence_essential3,Competence_optional0,Competence_optional1,Competence_optional2,Knowledge_essential0,Knowledge_essential1,Knowledge_essential2,Knowledge_essential3,Knowledge_optional0,Knowledge_optional1,Knowledge_optional2,Language_essential0,Language_essential1,Language_optional0,Language_level0,Language_level1,Language_level2,Experience_essential,Experience_optional
144,international student exchange coordinator,{'group': '3343'},Degree,Bachelor-D.,18,31,Verona,process reservations,manage educational institution's administration,-,-,oversee extra-curricular activities,maintain financial records,have computer literacy,travel bookings processes,education administration,-,-,electronic communication,customer service,-,Italian,English,-,C1,Any,-,1,True
145,information manager,{'group': '2622'},Less-than-degree,Degree,19,39,Genola,perform customer management,develop information standards,determine informational needs,-,use databases,supervise daily information operations,manage operational budgets,data quality assessment,copyright legislation,-,-,-,-,-,Italian,German,French,A2,Any,Any,1,False
146,animal therapist,{'group': '2250'},Bachelor-D.,-,21,31,Villafranca Tirrena,plan physical rehabilitation of animals,handle veterinary emergencies,assess the animals rehabilitation requirements,advise on animal welfare,-,-,-,signs of animal illness,physiology of animals,biosecurity related to animals,animal behaviour,-,-,-,Bengali,-,Italian,A2,-,Any,-,False
147,aircraft engine tester,{'group': '3115'},Master-D.,PhD,24,42,Vigonovo,record trial data,understand information presented in standard blueprints,conduct evaluations of engine performance,manage performance test,write records for repairs,supervise staff,-,operation of different engines,components of engines,-,-,engineering application principles,-,-,French,-,-,Any,-,-,1,True
148,computer science lecturer,{'group': '2310'},Master-D.,-,24,44,Venezia,think abstractly,prepare lesson content,assist students with equipment,apply teaching strategies,write scientific publications,manage open publications,develop professional network with researchers and scientists,Scratch (computer programming),Microsoft Visual C++,C#,-,assessment processes,Waterfall development,AJAX,Italian,Arabic,-,A1,A1,-,-,False
149,conservation scientist,{'group': '2133'},Bachelor-D.,Master-D.,21,30,Canale,use ICT resources to solve work related tasks,respond to enquiries,promote open innovation in research,manage findable accessible interoperable and reusable data,support volunteers,perform project management,negotiate land access,geographic information systems,environmental legislation,business management principles,biology,chemistry,-,-,Spanish,-,-,Any,-,-,2,False
150,veterinary scientist,{'group': '2250'},Master-D.,PhD,26,31,Verona,collect samples from animals,adhere to scientific research code of ethics,-,-,teach in academic or vocational contexts,take advantage of learning opportunities in veterinary science,manage resources for educational purposes,terminology of veterinary vocabulary,fundamentals of veterinary sciences,anatomy of animals,-,-,-,-,Italian,English,-,B2,Any,-,2,False
151,investor relations manager,{'group': '2412'},Bachelor-D.,-,22,32,Volta Mantovana,follow company standards,analyse market financial trends,analyse financial performance of a company,analyse business plans,synthesise information on finances,integrate shareholders' interests in business plans,develop PR strategies,modern portfolio theory,methods for funding,collective civil responsibility,-,-,-,-,English,-,-,Any,-,-,-,False
152,aircraft fuel system operator,{'group': '8332'},Degree,-,22,39,Torino,report on fuel distribution incidents,identify airport safety hazards,ensure maintenance of fuel distribution facilities,conduct aviation fuel servicing operations,perform manual work autonomously,-,-,fuel inventory methods,fuel distribution systems,-,-,-,-,-,French,Arabic,German,Any,C1,Any,2,False
153,court administrator,{'group': '1349'},Degree,-,21,41,San Giovanni in Persiceto,oversee covert actions,manage staff,maintain operational communications,ensure compliance with policies,supervise legal case procedures,record court procedures,advise court officials,legal case management,court procedures,-,-,correctional processes,theories of budgeting,accounting techniques,French,-,-,Any,-,-,1,True
154,inland water transport general manager,{'group': '1324'},Degree,-,20,35,San Pancrazio Salentino,plan transport operations,plan daily ship operations,manage vessel fleet,-,-,-,-,inland waterway police regulations,financial capability,environmental aspects of inland waterway transportation,-,-,-,-,Spanish,-,-,C1,-,-,1,True
155,flight test engineer,{'group': '2152'},Bachelor-D.,-,23,42,Venezia,perform scientific research,oversee aircraft sensor and recording systems,-,-,perform take off and landing,perform routine flight operations checks,perform flight manoeuvres,industrial engineering,engineering processes,engineering principles,aircraft flight control systems,instrumentation engineering,electronics,aerodynamics,Italian,English,-,C2,Any,-,1,False
156,back office specialist,{'group': '4312'},Degree,-,23,41,Bellinzago Lombardo,use office systems,provide financial product information,monitor company policy,manage administrative systems,provide support in financial calculation,-,-,office software,financial management,business processes,banking activities,principles of insurance,-,-,Italian,English,-,B1,A2,-,3,False
157,industrial waste inspector,{'group': '3257'},Master-D.,-,28,42,Castelvisconti,manage health and safety standards,issue penalties to violators of the sanitation code,-,-,perform laboratory tests,issue licences,inspect waste disposal facilities,environmental legislation,environmental engineering,-,-,-,-,-,Spanish,-,-,Any,-,-,2,False
158,labour market policy officer,{'group': '2422'},Bachelor-D.,Master-D.,24,38,Servigliano,promote employment policy,manage government policy implementation,-,-,perform project management,liaise with union officials,develop professional network,labour market,labour legislation,labour law,-,scientific research methodology,-,-,Italian,English,-,A1,Any,-,4,True
159,sales assistant,{'group': '5223'},Degree,Bachelor-D.,18,23,Pagani,stock shelves,balance cash point,follow up orders for customers,examine merchandise,supervise merchandise displays,perform multiple tasks at the same time,-,product comprehension,company policies,characteristics of a service,qualities of products,teamwork principles,-,-,Spanish,English,Italian,Any,Any,Any,2,False
160,choirmaster/choirmistress,{'group': '2652'},Degree,-,22,31,Pavia,work with composers,supervise music groups,read musical score,plan musical performances,develop cultural activities,-,-,musical theory,musical genres,music literature,-,-,-,-,Italian,Arabic,French,A1,Any,Any,2,True
161,footwear production manager,{'group': '1321'},Degree,-,20,31,Olbia,use IT tools,plan supply chain logistics for footwear and leather goods,-,-,manage footwear quality systems,determine footwear warehouse layout,apply assembling techniques for cemented footwear construction,manual cutting processes for leather,footwear uppers pre-assembly,assembling processes and techniques for goodyear footwear construction,assembling processes and techniques for california footwear construction,footwear equipments,footwear creation process,automatic cutting systems for footwear and leather goods,French,-,Spanish,B1,-,Any,1,True
162,news anchor,{'group': '2656'},Degree,Bachelor-D.,19,30,Paciano,memorise lines,develop professional network,-,-,perform improvisation,moderate a debate,-,pronunciation techniques,grammar,breathing techniques,audiovisual equipment,press law,news analytics,lighting techniques,Italian,Albanian,-,A2,C2,-,1,True
163,choreologist,{'group': '2653'},Less-than-degree,Degree,19,37,Castelli Calepio,work with respect for own safety,monitor art scene developments,act as a resource person in dance,-,work in an international environment,show intercultural awareness,inspire enthusiasm for dance,labour legislation,intellectual property law,art-historical values,-,-,-,-,Italian,English,Spanish,Any,C2,Any,1,False
164,milk heat treatment process operator,{'group': '8160'},Degree,Bachelor-D.,20,27,Cosenza,follow verbal instructions,implement HACCP,-,-,liaise with colleagues,-,-,temperature scales,food preservation,-,-,-,-,-,Bengali,-,French,B2,-,Any,3,False
165,equine yard manager,{'group': '6121'},Degree,-,22,33,Castellammare del Golfo,work independently in agriculture,livestock overseeing,manage agricultural staff,-,-,-,-,customer relationship management,concept of bio-security,agricultural business management,-,-,-,-,German,-,-,Any,-,-,3,False
166,motor vehicle aftersales manager,{'group': '1221'},Degree,-,21,32,Chiari,provide customer follow-up services,performing a customers needs analysis,ensure compliance with warranty contracts,developing an after sale policy,-,-,-,products comprehension,consumer protection,commercial legislation,-,car operation,-,-,Spanish,French,-,C1,B1,-,1,False
167,locksmith,{'group': '7222'},Degree,Bachelor-D.,21,37,Latina,maintain customer service,install lockable devices,copy keys,-,writing of records for repairs,train employees,respond to emergency calls for repairs,theory of mechanics,manufacturing of hinges,electronic locks,-,metal joining technologies,metal bending techniques,-,Italian,-,Spanish,A2,-,Any,2,False
168,tax inspector,{'group': '3352'},Master-D.,PhD,24,33,Torino,monitor financial accounts,inspect taxation documents,inspect tax returns,calculate tax,-,-,-,fiscal statutes,public income,-,-,office software,real estate revenues,audit techniques,English,-,Arabic,Any,-,Any,3,False
169,optical disc moulding machine operator,{'group': '8142'},Less-than-degree,Degree,18,27,Torino,set up the controller of a machine,run test pressings,monitor automated machines,-,prepare workpieces for etching,prepare workpieces for engraving,-,quality standards,coating substances,-,-,screen printing process,master disc manufacturing,-,French,Bengali,-,Any,C1,-,3,False
170,nuclear medicine radiographer,{'group': '2269'},Bachelor-D.,-,22,27,Campiglia Marittima,provide psychological support to patients,listen actively,-,-,employ the use of foreign languages in care,use foreign languages for health-related research,apply medical research techniques,radiation biology,human physiology,-,-,-,-,-,Italian,French,-,Any,Any,-,3,False
171,anthropology lecturer,{'group': '2310'},Master-D.,PhD,26,35,Cornedo Vicentino,write work-related reports,mentor individuals,apply intercultural teaching strategies,-,speak different languages,publish academic research,observe human behaviour,curriculum objectives,anthropology,-,-,university procedures,scientific research methodology,religious studies,English,-,-,A1,-,-,-,False
172,computer and accessories specialised seller,{'group': '5223'},Less-than-degree,-,21,34,Sassari,examine merchandise,demonstrating a products' features,-,-,add computer components,-,-,product comprehension,multimedia systems,e-commerce systems,product characteristics,ICT software specifications,an ICT hardware specification,-,Russian,Italian,English,Any,A2,Any,1,False
173,deburring machine operator,{'group': '8122'},Less-than-degree,-,16,25,Notaresco,tend deburring machine,remove processed workpiece,monitor moving workpiece in a machine,ensure equipment availability,wear appropriate protective gear,operate precision measuring equipment,-,types of deburring brush,quality standards,deburring machine parts,-,manufacturing of steel drums and similar containers,-,-,Spanish,Italian,French,C2,C1,Any,1,True
174,ICT usability tester,{'group': '2519'},Degree,Bachelor-D.,20,25,Corigliano Calabro,use experience map,replicate customer software issues,measure software usability,-,-,-,-,human-computer interaction,behavioural science,software usability,-,-,-,-,Italian,-,-,A2,-,-,-,False
175,bakery specialised seller,{'group': '5223'},Degree,-,18,32,Boltiere,monitor stock level,carry out order intake,-,-,-,-,-,sales argumentation,e-commerce systems,composition of bakery goods,characteristics of products,-,-,-,Spanish,-,-,C2,-,-,1,True
176,industrial pharmacist,{'group': '2262'},Master-D.,PhD,27,38,Cornedo Vicentino,comply with legislation related to health care,apply professional assessment of clients,adhere to organisational guidelines,-,perform toxicological studies,manage medication safety issues,maintaining medical devices,legal framework for pharmacy activities,therapy using pharmaceutical drugs,organic chemistry,characteristics of inorganic chemistry,botany,-,-,German,English,French,Any,B1,Any,4,True
177,food analyst,{'group': '3111'},Master-D.,PhD,27,46,L'Aquila,perform physico-chemical analysis to food materials,follow the laboratory manual,-,-,-,-,-,antibody microorganisms in food,laboratory-based sciences,food safety standards,food safety measures,-,-,-,Spanish,-,French,C1,-,Any,2,True
178,flower and garden shop manager,{'group': '1420'},Master-D.,-,25,31,Carpi,recruiting employees,oversee a promotional sales price,-,-,-,-,-,sales activities,employment law,-,-,-,-,-,German,French,-,B2,A2,-,3,True
179,psychologist,{'group': '2634'},Less-than-degree,-,16,32,San Giovanni la Punta,monitor therapeutic progress,listen actively,demonstrate disciplinary expertise,-,-,-,-,psychology,behavioural disorders,-,-,causes of psychiatric disorders,psychiatric diagnostics,personal reflection techniques based on feedback,Italian,-,-,B2,-,-,5,False
180,post-production supervisor,{'group': '2654'},Less-than-degree,Degree,16,32,Rosignano Marittimo,read scripts,consult with producer,-,-,manage accounts,calculate production costs,-,film production method,accounting skills,-,-,photography,-,-,French,-,-,Any,-,-,1,False
181,camera operator,{'group': '3521'},Degree,-,22,33,Alfonsine,use technical documentation,set up cameras,set up audiovisual peripheral equipment,ensure visual quality of the set,-,-,-,photography,cinematography,audiovisual equipment,-,file-based workflow,-,-,Spanish,-,French,Any,-,Any,1,False
182,health and safety officer,{'group': '2263'},Master-D.,PhD,26,33,Ghedi,present reports,oversee policies development,follow industrial safety standards,advise on risk management,provide improvement strategies,educate on emergency management,-,"health, safety and hygiene legislation rules",environmental legislation,techniques for handlingsecurity-related information,-,project management,International Convention for the Prevention of Pollution from Ships,employment law,Spanish,English,-,B1,A1,-,2,False
183,immunologist,{'group': '2131'},Bachelor-D.,-,23,36,Latina,write scientific publications,manage personal professional development,apply scientific methods,-,recommend product improvements,archive scientific documentation,-,scientific research methodology,molecular and cellular immunology,laboratory techniques,-,microbiology-bacteriology,-,-,German,-,-,C2,-,-,-,False
184,property acquisitions manager,{'group': '3334'},Degree,-,19,24,Villasanta,interact with financiers,collect property financial information,-,-,supervise housing development projects,provide information on properties,monitor property right transfers,real estate market,property legislation,financial analysis,corporate social responsibility,financial statements,financial management,-,English,-,-,C1,-,-,1,True
185,community social worker,{'group': '2635'},Master-D.,PhD,27,46,Riva del Garda,raise awareness on local community's priorities,promote inclusion,meet standards of practice in social services,-,support social service users to live at home,support children's wellbeing,-,social sciences,social justice,counselling methods,company policies,-,-,-,Italian,Arabic,-,B1,C1,-,1,True
186,locksmith,{'group': '7222'},Less-than-degree,-,16,27,Trani,use locksmith equipment,install lockable devices,cut keys,-,allocate keys,-,-,theory of mechanics,electronic locks,-,-,metal varieties,metal joining technologies,metal bending techniques,English,-,-,Any,-,-,1,True
187,quality engineer,{'group': '2149'},Master-D.,PhD,28,45,Colognola ai Colli,supporting quality management systems implementation,performing a  risk analysis,audit quality of products,identifying improvement opportunities,use measurement instruments,maintain test equipment,communicate test results to other departments,test procedures,quality standards,-,-,manufacturing measures,PDCA,industrial engineering research,Italian,-,-,B2,-,-,-,False
188,wood technology engineer,{'group': '2149'},Master-D.,PhD,24,39,Torino,draw blueprints,advise customers on wood products,-,-,use CAD software,inspect wood materials,-,woodworking processes,types of wood,construction products,civil engineering,wood cuts,cost management,-,Italian,English,-,Any,A2,-,2,False
189,legal assistant,{'group': '3411'},Bachelor-D.,-,25,40,Boltiere,study court hearings,revise legal document,manage accounts,-,handle commissioned instructions,perform office activities,carry out office work,legal terminology,judicial analysis,-,-,-,-,-,French,English,Italian,Any,A1,Any,1,False
190,tobacco shop manager,{'group': '1420'},Degree,-,23,30,Cornaredo,negotiate buying conditions,monitor customer service,handle sensitive products,ensure correct goods labelling,-,-,-,tobacco brands,sales activities,employment law,-,-,-,-,Italian,English,-,B1,A2,-,-,False
191,poultry sexer,{'group': '6122'},Less-than-degree,Degree,20,37,Cantarana,safely interact with animals,apply animal hygiene practices,-,-,monitor livestock,handle poultry,-,livestock selection principles,animal welfare legislation,-,-,quality criteria for livestock feed production,livestock species,livestock farming systems,Italian,English,-,A1,A1,-,1,True
192,political journalist,{'group': '2642'},Master-D.,-,26,32,Ostra Vetere,interview people,apply grammar and spelling rules,-,-,write caption,edit articles,present during live broadcasts,spelling,affiliations parties,interview procedures,copyrighting legislation,pronunciation procedures,multimedia system,ICT software specifications,English,-,German,Any,-,Any,1,False
193,fisheries deckhand,{'group': '8350'},Degree,Bachelor-D.,21,37,Caltanissetta,maintain safe navigation watches,follow verbal instructions,-,-,work in a fishery team,relay messages through radio and telephone systems,operate ship rescue machinery,quality assurance methodologies,pollution prevention,health and safety regulations,fishing equipment,techniques for handlingsecurity-related information,features of Global Maritime Distress and Safety System,-,Italian,-,-,C2,-,-,-,False
194,corporate banking manager,{'group': '2412'},Bachelor-D.,-,23,28,Torino,provide legal advice on investments,investigate milled grains,advise on financial matters,-,assess risk factors,-,-,security,commercial analysis,-,-,stock market,mergers and acquisitions,financial jurisdiction,French,Bengali,-,Any,B2,-,-,False
195,animal care attendant,{'group': '5164'},Less-than-degree,Degree,19,25,Bagno a Ripoli,provide an enriching environment for animals,groom animals,assist with transferring animals,-,establish aquarium,deal with challenging people,-,safe work practices in a veterinary work environment,animal welfare legislation,typology of animal food,animal behaviour,animal-training,animal species,animal production science,Italian,-,Albanian,C2,-,Any,1,True
196,landscape designer,{'group': '2162'},Degree,-,18,30,Verona,perform weed control operations,perform studies and field investigation,inspect project regulations,create landscape designs,-,-,-,surveying methods,typology plant disease,typology of landscape architectural instruments and codes,-,plant cultivation,types of forest ecology,construction laws,French,Chinese,-,Any,C2,-,1,True
197,metal nibbling operator,{'group': '7223'},Less-than-degree,-,20,38,Venezia,troubleshoot,remove inadequate workpieces,operate scrap vibratory feeder,dispose of cutting waste material,tend nibbling machine,inspect quality of products,advise on machinery malfunctions,types of metal,quality standards,dies,-,manufacturing of weapons and ammunition,manufacturing of metal household articles,manufacturing of light metal packaging,German,French,-,A1,C1,-,4,True
198,classical languages lecturer,{'group': '2310'},Master-D.,-,29,37,Giarre,think abstractly,guide individuals,apply teaching strategy,-,support teamwork between students,conduct scholarly research,conduct research across disciplines,language teaching methods,curriculum goals,classical languages,classical antiquities,linguistics,assessment practices,-,French,English,-,A1,B2,-,2,False
199,waste treatment engineer,{'group': '2143'},Master-D.,PhD,26,43,Torino,maintain waste collection records,write strategies for non-hazardous waste management,-,-,-,-,-,technical drawings,energy,characteristics of waste,-,pollution legislation,hazardous waste types,-,Bengali,-,-,A1,-,-,-,False
